{
  "schema_version": 1,
  "review_id": "30a2ea93-8ea0-43be-ab7e-77bfa64730a4",
  "kind": "plugin_settings",
  "source": "desktop_host",
  "review_digest": "sha256:dddddddddddddddddddddddddddddddddddddddddddddddddddddddddddddddd",
  "intent_id": "60675e8d-b7a2-4602-b744-4c85d6dc0206",
  "plugin_id": "@catomicals/plugin-executor-codex",
  "plugin_version": "1.0.0",
  "created_at": "2026-08-27T08:02:00Z",
  "state": "current"
}
